{"$defs":{"policy":{"additionalProperties":false,"properties":{"evidence_key":{"pattern":"^[0-9a-f]{64}$","type":"string"},"evidence_kinds":{"items":{"minLength":1,"type":"string"},"minItems":1,"type":"array","uniqueItems":true},"policy_version":{"minLength":1,"type":"string"},"scope":{"minLength":1,"type":"string"},"subject_key":{"pattern":"^[0-9a-f]{64}$","type":"string"}},"required":["subject_key","scope","policy_version","evidence_key","evidence_kinds"],"type":"object"},"proof":{"additionalProperties":false,"properties":{"payload_hex":{"maxLength":32768,"pattern":"^(?:[0-9a-f]{2})+$","type":"string"},"public_key_hex":{"pattern":"^[0-9a-f]{64}$","type":"string"},"signature_hex":{"pattern":"^[0-9a-f]{128}$","type":"string"}},"required":["payload_hex","public_key_hex","signature_hex"],"type":"object"},"request":{"oneOf":[{"additionalProperties":false,"properties":{"operation":{"const":"admit"},"policy":{"$ref":"#/$defs/policy"},"proof":{"$ref":"#/$defs/proof"},"state":{"$ref":"#/$defs/state"}},"required":["operation","state","proof","policy"],"type":"object"},{"additionalProperties":false,"properties":{"operation":{"const":"transition"},"policy":{"$ref":"#/$defs/policy"},"proof":{"$ref":"#/$defs/proof"},"state":{"$ref":"#/$defs/state"}},"required":["operation","state","proof","policy"],"type":"object"},{"additionalProperties":false,"properties":{"operation":{"const":"consume"},"policy":{"$ref":"#/$defs/policy"},"proof":{"$ref":"#/$defs/proof"},"schedule":{"items":{"additionalProperties":false,"properties":{"kind":{"enum":["read","commit"]},"worker":{"minLength":1,"type":"string"}},"required":["kind","worker"],"type":"object"},"maxItems":32,"minItems":2,"type":"array"},"state":{"$ref":"#/$defs/state"}},"required":["operation","state","proof","policy","schedule"],"type":"object"},{"additionalProperties":false,"properties":{"evidence":{"items":{"$ref":"#/$defs/proof"},"maxItems":16,"type":"array"},"operation":{"const":"confirm"},"policy":{"$ref":"#/$defs/policy"},"proof":{"$ref":"#/$defs/proof"},"state":{"$ref":"#/$defs/state"}},"required":["operation","state","proof","policy","evidence"],"type":"object"},{"additionalProperties":false,"properties":{"operation":{"const":"ingest"},"paths":{"items":{"enum":["live","snapshot","import","restore"]},"maxItems":4,"minItems":4,"type":"array","uniqueItems":true},"policy":{"$ref":"#/$defs/policy"},"proof":{"$ref":"#/$defs/proof"},"state":{"$ref":"#/$defs/state"}},"required":["operation","state","proof","policy","paths"],"type":"object"}]},"state":{"additionalProperties":false,"properties":{"head":{"minLength":1,"type":"string"},"revision":{"maximum":1000000,"minimum":0,"type":"integer"}},"required":["revision","head"],"type":"object"}},"$id":"urn:rsi:registered-relation-binding-fixture:v0","$schema":"https://json-schema.org/draft/2020-12/schema","additionalProperties":false,"properties":{"cases":{"items":{"additionalProperties":false,"properties":{"local_validity_expected":{"type":"boolean"},"name":{"enum":["control","mutation","mirror_positive"]},"requests":{"additionalProperties":{"$ref":"#/$defs/request"},"minProperties":1,"propertyNames":{"pattern":"^[A-Za-z0-9][A-Za-z0-9._-]{0,127}$"},"type":"object"}},"required":["name","local_validity_expected","requests"],"type":"object"},"maxItems":3,"minItems":3,"type":"array"},"id":{"pattern":"^(?:[a-z0-9][a-z0-9._-]{0,63}:)?[A-Za-z0-9][A-Za-z0-9._-]{0,127}$","type":"string"},"mutation_model":{"enum":["relation_substitution","invalid_authentication","concurrent_schedule","cross_path"]},"profile_version":{"const":"rsi-reference-profile.v0"},"protected_relation":{"enum":["signer_to_subject","authentication_before_commit","atomic_consumption","context_binding","evidence_bounded_status","ingestion_equivalence"]},"schema":{"const":"relation-binding-fixture.v0"}},"required":["schema","id","protected_relation","mutation_model","profile_version","cases"],"type":"object","x-canonical-serializer":"rsi-json-ascii.v0"}
