{"cases":[{"local_validity_expected":true,"name":"control","requests":{"generic":{"evidence":[{"payload_hex":"7b226b696e64223a226a6f75726e616c5f636f6d6d6974222c226f7065726174696f6e5f6964223a22726563656970742d303031222c2273636f7065223a22726563656970743a73636f70652d61227d0a","public_key_hex":"54ad810c88e2eac384fe6108da1250bba4f512214d74c876816406d6a921eda0","signature_hex":"d927bad97ba945ca89ec15e648386bb12000d57d7547608dba7edd3a0d48d15ac39a32814d92bd0c530d457b426171e4df2b3d845a0b2ad076af4ec562e4c30b"}],"operation":"confirm","policy":{"evidence_key":"54ad810c88e2eac384fe6108da1250bba4f512214d74c876816406d6a921eda0","evidence_kinds":["journal_commit","settlement_receipt"],"policy_version":"policy.v1","scope":"receipt:scope-a","subject_key":"ebd9fb58f0a91c4049042e8e6febe49d5b9622476f1f4dd70a53fc5ddc49246e"},"proof":{"payload_hex":"7b22646f6d61696e223a2272656365697074222c226f7065726174696f6e5f6964223a22726563656970742d303031222c227061796c6f6164223a2273796e746865746963207075626c69632064617461222c22706f6c6963795f76657273696f6e223a22706f6c6963792e7631222c2273636f7065223a22726563656970743a73636f70652d61227d0a","public_key_hex":"ebd9fb58f0a91c4049042e8e6febe49d5b9622476f1f4dd70a53fc5ddc49246e","signature_hex":"ccc62b5e0a8d67c5844e84400e68a86cc033f05da50a21b9cd5ab9916e9eb8e7be4181fd19cc1595f86198e8e701be3712f62ef3e1d666f4c1297643af975003"},"state":{"head":"initial","revision":0}},"messaging":{"evidence":[{"payload_hex":"7b226b696e64223a22726563697069656e745f61636b222c226f7065726174696f6e5f6964223a226d6573736167652d303031222c2273636f7065223a226d6573736167653a73636f70652d61227d0a","public_key_hex":"54ad810c88e2eac384fe6108da1250bba4f512214d74c876816406d6a921eda0","signature_hex":"55520f875d54c5915c7bc4096a227e24eaa35081ff3e1999f524932f3b606b5da709410cf4490020e9bf898c13de37c69736bf6a7dab4f2ca4d1bd960b768202"}],"operation":"confirm","policy":{"evidence_key":"54ad810c88e2eac384fe6108da1250bba4f512214d74c876816406d6a921eda0","evidence_kinds":["recipient_ack","durable_publication"],"policy_version":"policy.v1","scope":"message:scope-a","subject_key":"ebd9fb58f0a91c4049042e8e6febe49d5b9622476f1f4dd70a53fc5ddc49246e"},"proof":{"payload_hex":"7b22646f6d61696e223a226d657373616765222c226f7065726174696f6e5f6964223a226d6573736167652d303031222c227061796c6f6164223a2273796e746865746963207075626c69632064617461222c22706f6c6963795f76657273696f6e223a22706f6c6963792e7631222c2273636f7065223a226d6573736167653a73636f70652d61227d0a","public_key_hex":"ebd9fb58f0a91c4049042e8e6febe49d5b9622476f1f4dd70a53fc5ddc49246e","signature_hex":"826504810ce9cf116c64ebec62a8abc78d0f33e6449f446dae67dd29fd3408794d2416afec985e354db8590c6436777c611c0ab0fc686590330073c7f729c90e"},"state":{"head":"initial","revision":0}}}},{"local_validity_expected":true,"name":"mutation","requests":{"generic":{"evidence":[],"operation":"confirm","policy":{"evidence_key":"54ad810c88e2eac384fe6108da1250bba4f512214d74c876816406d6a921eda0","evidence_kinds":["journal_commit","settlement_receipt"],"policy_version":"policy.v1","scope":"receipt:scope-a","subject_key":"ebd9fb58f0a91c4049042e8e6febe49d5b9622476f1f4dd70a53fc5ddc49246e"},"proof":{"payload_hex":"7b22646f6d61696e223a2272656365697074222c226f7065726174696f6e5f6964223a22726563656970742d303031222c227061796c6f6164223a2273796e746865746963207075626c69632064617461222c22706f6c6963795f76657273696f6e223a22706f6c6963792e7631222c2273636f7065223a22726563656970743a73636f70652d61227d0a","public_key_hex":"ebd9fb58f0a91c4049042e8e6febe49d5b9622476f1f4dd70a53fc5ddc49246e","signature_hex":"ccc62b5e0a8d67c5844e84400e68a86cc033f05da50a21b9cd5ab9916e9eb8e7be4181fd19cc1595f86198e8e701be3712f62ef3e1d666f4c1297643af975003"},"state":{"head":"initial","revision":0}},"messaging":{"evidence":[],"operation":"confirm","policy":{"evidence_key":"54ad810c88e2eac384fe6108da1250bba4f512214d74c876816406d6a921eda0","evidence_kinds":["recipient_ack","durable_publication"],"policy_version":"policy.v1","scope":"message:scope-a","subject_key":"ebd9fb58f0a91c4049042e8e6febe49d5b9622476f1f4dd70a53fc5ddc49246e"},"proof":{"payload_hex":"7b22646f6d61696e223a226d657373616765222c226f7065726174696f6e5f6964223a226d6573736167652d303031222c227061796c6f6164223a2273796e746865746963207075626c69632064617461222c22706f6c6963795f76657273696f6e223a22706f6c6963792e7631222c2273636f7065223a226d6573736167653a73636f70652d61227d0a","public_key_hex":"ebd9fb58f0a91c4049042e8e6febe49d5b9622476f1f4dd70a53fc5ddc49246e","signature_hex":"826504810ce9cf116c64ebec62a8abc78d0f33e6449f446dae67dd29fd3408794d2416afec985e354db8590c6436777c611c0ab0fc686590330073c7f729c90e"},"state":{"head":"initial","revision":0}}}},{"local_validity_expected":true,"name":"mirror_positive","requests":{"generic":{"evidence":[{"payload_hex":"7b0a2020226b696e64223a20226a6f75726e616c5f636f6d6d6974222c0a2020226f7065726174696f6e5f6964223a2022726563656970742d303031222c0a20202273636f7065223a2022726563656970743a73636f70652d61220a7d","public_key_hex":"54ad810c88e2eac384fe6108da1250bba4f512214d74c876816406d6a921eda0","signature_hex":"dc9003d8a25c25c92920f3cb301a8464c6a68d6a3ccb022e5e827d0a3f54908443a908566ccd5e675899f2ea104363b7ea9e4cecddf5ebbdfa9f96b76999a406"}],"operation":"confirm","policy":{"evidence_key":"54ad810c88e2eac384fe6108da1250bba4f512214d74c876816406d6a921eda0","evidence_kinds":["journal_commit","settlement_receipt"],"policy_version":"policy.v1","scope":"receipt:scope-a","subject_key":"ebd9fb58f0a91c4049042e8e6febe49d5b9622476f1f4dd70a53fc5ddc49246e"},"proof":{"payload_hex":"7b0a202022646f6d61696e223a202272656365697074222c0a2020226f7065726174696f6e5f6964223a2022726563656970742d303031222c0a2020227061796c6f6164223a202273796e746865746963207075626c69632064617461222c0a202022706f6c6963795f76657273696f6e223a2022706f6c6963792e7631222c0a20202273636f7065223a2022726563656970743a73636f70652d61220a7d","public_key_hex":"ebd9fb58f0a91c4049042e8e6febe49d5b9622476f1f4dd70a53fc5ddc49246e","signature_hex":"2f60c4455ca9aad7630e5d5528f3efb9fbaadf7701922961da274f01d44f124902d8e1a5f9e51d669d6d8180260943e8b4a77b258273e1efb6d132912add010a"},"state":{"head":"initial","revision":0}},"messaging":{"evidence":[{"payload_hex":"7b0a2020226b696e64223a2022726563697069656e745f61636b222c0a2020226f7065726174696f6e5f6964223a20226d6573736167652d303031222c0a20202273636f7065223a20226d6573736167653a73636f70652d61220a7d","public_key_hex":"54ad810c88e2eac384fe6108da1250bba4f512214d74c876816406d6a921eda0","signature_hex":"e4a7e135cd1f8bc0310fc5e5841d79aace043e4a688b48f736f7dda4f7be8baa9fbaf1afe1730950446c134bbce7e2084dfb83086122b3a52f2d7923a1097807"}],"operation":"confirm","policy":{"evidence_key":"54ad810c88e2eac384fe6108da1250bba4f512214d74c876816406d6a921eda0","evidence_kinds":["recipient_ack","durable_publication"],"policy_version":"policy.v1","scope":"message:scope-a","subject_key":"ebd9fb58f0a91c4049042e8e6febe49d5b9622476f1f4dd70a53fc5ddc49246e"},"proof":{"payload_hex":"7b0a202022646f6d61696e223a20226d657373616765222c0a2020226f7065726174696f6e5f6964223a20226d6573736167652d303031222c0a2020227061796c6f6164223a202273796e746865746963207075626c69632064617461222c0a202022706f6c6963795f76657273696f6e223a2022706f6c6963792e7631222c0a20202273636f7065223a20226d6573736167653a73636f70652d61220a7d","public_key_hex":"ebd9fb58f0a91c4049042e8e6febe49d5b9622476f1f4dd70a53fc5ddc49246e","signature_hex":"1d36bdac4e94a5462017bc8091d85252e2120dd67a2ccc272c8925c44e298a4ddb6053c00dcfd4519d62b91cd7cf1f5c51b054dbfd84549ca3aabfb6f34fb80f"},"state":{"head":"initial","revision":0}}}}],"id":"RSI-008","mutation_model":"relation_substitution","profile_version":"rsi-reference-profile.v0","protected_relation":"evidence_bounded_status","schema":"relation-binding-fixture.v0"}
